{
  "$schema": "https://devbox.zenit-hosting.de/schema/history-entry.v1.json",
  "$comment": "Own example: a session started as part of the update-all group.",
  "id": "s_01JB8Y4A7QXR2N5T9VWZ3M6P8C",
  "action": "java.update",
  "plugin": "java",
  "group": "update-all",
  "title": "Update Java",
  "user": "dev",
  "origin": "group",
  "dryRun": false,
  "startedAt": "2026-10-27T09:20:11Z",
  "endedAt": "2026-10-27T09:50:11Z",
  "state": "timeout",
  "exitCode": null,
  "changes": 1,
  "summary": "Download did not finish within 30m"
}
